id,sentence,subject_entity,object_entity,label
401,"알렉시스 코너(Alexis Korner), 시릴 데이비스(Cyril Davis), 스크리밍 로드 서치(Screamin' Lord Sutch), 그래험 본드(Graham Bond), 존 메이올 등의 선구자들에 의해 꽃 피우기 시작한 영국의 블루스는 자국의 탄탄한 음악적 전통 속에서 블루스의 본산지인 미국의 시도에 앞서 나가기 시작했다.","{'word': '영국의 블루스', 'start_idx': 129, 'end_idx': 135, 'type': 'GEN'}","{'word': '스크리밍 로드 서치', 'start_idx': 46, 'end_idx': 55, 'type': 'ART'}",genre:artist
2254,1969년에 발매된 레드 제플린의 기념비적인 첫 앨범은 하드 록의 시작을 나타내는 블루스 록을 싣고 있다. 이들의 앨범은 블루스의 영향이 선명히 드러난다. 유명한 블루스 음악가들의 노래를 개작하거나 커버한 노래도 조금 실렸다.,"{'word': '블루스', 'start_idx': 91, 'end_idx': 93, 'type': 'GEN'}","{'word': '레드 제플린', 'start_idx': 11, 'end_idx': 16, 'type': 'ART'}",genre:artist
1434,"록 밴드들은 펑크의 요소들을 그들의 소리에 복사하기 시작했고, ""펑크 록""과 ""펑크 메탈""의 새로운 조합을 만들어냈다.","{'word': '록 밴드들', 'start_idx': 0, 'end_idx': 4, 'type': 'COM'}","{'word': '펑크 록', 'start_idx': 36, 'end_idx': 39, 'type': 'GEN'}",no_relation
1990,"보통 포크는 기타, 밴조, 리코더, 하모니카, 콘서티나, 아코디언, 만돌린, 바이올린, 세트 형태가 아닌 한 개의 드럼을 사용하는 반면, 포크록은 전기 기타, 베이스 기타, 신시사이저를 쓰고 드럼 세트로 록 비트를 붙인다. 1967년경부터 사이케데릭 사운드 등 여러 가지 신종 록의 움직임이 왕성해짐에 따라 포크록도 그 안에 흡수된 것 같으며, 그 뒤로 이 말은 그리 쓰이지 않게 되었다.","{'word': '1967년경', 'start_idx': 125, 'end_idx': 130, 'type': 'DAT'}","{'word': '포크록', 'start_idx': 77, 'end_idx': 79, 'type': 'GEN'}",no_relation
484,"영국안에서, 밴드들은 전설적인 미국 블루스들을 따라하기 시작했고, 록을 기반으로한 영국 블루스 밴드는 1960년대에 막대한 영향을 끼치게 된다.","{'word': '영국 블루스', 'start_idx': 46, 'end_idx': 51, 'type': 'GEN'}","{'word': '록', 'start_idx': 37, 'end_idx': 37, 'type': 'GEN'}",genre:origin
975,사실 내슈빌 사운드는 70년대에 더 인기를 누렸는데 프로듀서 빌리 세릴 덕분이었다.,"{'word': '내슈빌 사운드', 'start_idx': 3, 'end_idx': 9, 'type': 'GEN'}","{'word': '70년대', 'start_idx': 12, 'end_idx': 15, 'type': 'DAT'}",no_relation
2801,"1924년 화이트맨은 조지 거슈윈의 Rhapsody in Blue를 의뢰했는데, 이 작품은 그의 오케스트라에 의해 초연되며 재즈는 주목할 만한 음악적 형태로 인식되기 시작했다.","{'word': '재즈', 'start_idx': 69, 'end_idx': 70, 'type': 'GEN'}","{'word': 'Rhapsody in Blue', 'start_idx': 20, 'end_idx': 35, 'type': 'POH'}",no_relation
311,"이 시기에 프레디 킹과 알버트 킹은 록, 소울 뮤지션 (에릭 클랩튼, 부커 T & the MGs)과 자주 연주 했고, 이러한 장르 음악에 막대한 영향력을 끼쳤다.","{'word': '록', 'start_idx': 20, 'end_idx': 20, 'type': 'GEN'}","{'word': '에릭 클랩튼', 'start_idx': 31, 'end_idx': 36, 'type': 'ART'}",genre:artist
1972,또 사회악과 싸우는 결의를 표명한 노래도 보통 프로테스트 송에 들어 있다. 대표적인 곡들은 모던 포크송 리스트에 함께 나열되어 있다.,"{'word': '프로테스트 송', 'start_idx': 26, 'end_idx': 32, 'type': 'GEN'}","{'word': '모던 포크송', 'start_idx': 51, 'end_idx': 56, 'type': 'GEN'}",no_relation
2032,또한 현재 최고의 상업적 성공을 거두고있는 마룬 5도 1990년대에 결성되었다.,"{'word': '1990년대', 'start_idx': 30, 'end_idx': 35, 'type': 'DAT'}","{'word': '마룬 5', 'start_idx': 24, 'end_idx': 27, 'type': 'ART'}",no_relation
3049,1930년대에 테너 색소폰 연주자 레스터 영에 의해 대표되는 캔자스 시티 재즈는 1940년대의 큰 밴드로부터 비밥의 영향력으로의 전환을 알렸다.,"{'word': '캔자스 시티 재즈', 'start_idx': 34, 'end_idx': 42, 'type': 'GEN'}","{'word': '레스터 영', 'start_idx': 19, 'end_idx': 23, 'type': 'ART'}",genre:artist
1102,"솔 음악(Soul Music)은 재즈 본래의 정신을 ""Soul (솔, 소울, 영혼)""이라는 말로 표현한 데서 비롯된 말이다. ","{'word': '솔 음악', 'start_idx': 0, 'end_idx': 3, 'type': 'GEN'}","{'word': 'Soul', 'start_idx': 30, 'end_idx': 33, 'type': 'POH'}",genre:origin
2361,비밥의 초기 2년 동안은 제2차 세계 대전 중 미국 음악인들의 고뇌를 표현한 그들만의 은어였다.,"{'word': '비밥', 'start_idx': 0, 'end_idx': 1, 'type': 'GEN'}","{'word': '제2차 세계 대전', 'start_idx': 14, 'end_idx': 22, 'type': 'DAT'}",genre:origin
3433,1960년 중반 자메이카 음악가들은 스카를 좀 더 느리게 연주하면서 오프 비트를 가미했고 알톤 엘리스는 이 음악을 자신의 음반에서 록스테디라 불렀다. 1960년대 말이 되자 음악가들은 리듬을 보다 느리게 하고 다른 여러가지 효과를 가미하여 레게를 만들게 되었다.,"{'word': '자메이카', 'start_idx': 9, 'end_idx': 12, 'type': 'LOC'}","{'word': '1960년 중반', 'start_idx': 0, 'end_idx': 7, 'type': 'DAT'}",no_relation
1282,기본적으로 펑크와 동일한 형태를 따르고 펑크의 특성을 유지하지만 TR-808과 같은 전자 기기를 사용하여 전체적으로(또는 부분적으로) 만든다.,"{'word': 'TR-808과 같은 전자 기기', 'start_idx': 36, 'end_idx': 51, 'type': 'POH'}","{'word': '펑크', 'start_idx': 6, 'end_idx': 7, 'type': 'GEN'}",no_relation
807,70년대 초반까지 독특하고 개인적인 곡들을 썼으며 매력적인 목소리를 가지고 있는 아티스트들은 상당한 규모의 추종자들을 이끌었고 프로그레시브 컨트리는 점차 주류 음악이 되었고 많은 버전으로 커버했다.,"{'word': '프로그레시브 컨트리', 'start_idx': 71, 'end_idx': 80, 'type': 'GEN'}","{'word': '70년대 초반', 'start_idx': 0, 'end_idx': 6, 'type': 'DAT'}",genre:origin
3259,"마일즈 데이비스가 1954년 제1회 뉴포트 재즈 페스티벌에서 공연한 ""Walkin""은 재즈계에 이러한 스타일을 알렸다.","{'word': '재즈', 'start_idx': 24, 'end_idx': 25, 'type': 'GEN'}","{'word': 'Walkin', 'start_idx': 39, 'end_idx': 44, 'type': 'POH'}",no_relation
1348,"Phish는 1996년경 펑크 잼을 연주하기 시작했고, 1998년작 <The Story of the Ghost>는 펑크의 영향을 많이 받았다.","{'word': 'The Story of the Ghost', 'start_idx': 39, 'end_idx': 60, 'type': 'POH'}","{'word': '1998년', 'start_idx': 31, 'end_idx': 35, 'type': 'DAT'}",product:origin
2579,"1920년부터 1933년까지 미국의 금주법은 주류 판매를 금지했고, 그 결과 불법 장소가 생겨나 ""재즈 시대""의 활기찬 장소가 되었고, 대중음악, 댄스곡, 참신한 노래, 쇼곡 등을 주최하였다.","{'word': '1920년부터 1933년까지', 'start_idx': 0, 'end_idx': 14, 'type': 'DAT'}","{'word': '대중음악', 'start_idx': 76, 'end_idx': 79, 'type': 'GEN'}",no_relation
2625,"1950년대와 1960년대를 거치면서 딕시랜드(Dixieland)는 비록 비평가들은 거의 신경을 쓰지 않았지만 미국, 유럽, 일본에서 상업적으로 가장 인기 있는 재즈 스타일 중 하나였다.","{'word': '1950년대', 'start_idx': 0, 'end_idx': 5, 'type': 'DAT'}","{'word': '미국', 'start_idx': 62, 'end_idx': 63, 'type': 'LOC'}",no_relation
1022,40년대 컨트리 뮤직은 다른 방향들로 갈라지기 시작했는데 홍키 통크와 컨트리 팝 장르가 그들의 일원이 되었다.,"{'word': '컨트리 뮤직', 'start_idx': 5, 'end_idx': 10, 'type': 'GEN'}","{'word': '컨트리 팝', 'start_idx': 39, 'end_idx': 43, 'type': 'GEN'}",genre:sub_genre
96,투팍과 비기의 다툼은 크게 미국 동부의 힙합과 서부의 힙합간의 대립으로 번지지만 투팍과 비기 모두의 죽음이라는 비극적인 결말로 종결을 맺는다.,"{'word': '비기', 'start_idx': 4, 'end_idx': 5, 'type': 'ART'}","{'word': '미국 동부의 힙합', 'start_idx': 15, 'end_idx': 23, 'type': 'GEN'}",no_relation
1632,"한편, 호주와 뉴질랜드에서는, Supergroove, Skunkhour, Truth와 같은 펍 서킷을 연주하는 밴드들이 더 기악적인 형태의 펑크를 보존했다.","{'word': '펑크', 'start_idx': 78, 'end_idx': 79, 'type': 'GEN'}","{'word': 'Skunkhour', 'start_idx': 30, 'end_idx': 38, 'type': 'ART'}",genre:artist
3256,"마일즈 데이비스가 1954년 제1회 뉴포트 재즈 페스티벌에서 공연한 ""Walkin""은 재즈계에 이러한 스타일을 알렸다.","{'word': '마일즈 데이비스', 'start_idx': 0, 'end_idx': 7, 'type': 'ART'}","{'word': 'Walkin', 'start_idx': 39, 'end_idx': 44, 'type': 'POH'}",producer:product
1401,1965년 이후 브라운의 밴드 리더는 알프레드 엘리스였다.,"{'word': '1965년', 'start_idx': 0, 'end_idx': 4, 'type': 'DAT'}","{'word': '알프레드 엘리스', 'start_idx': 21, 'end_idx': 28, 'type': 'ART'}",no_relation
1815,"현대 기독교 음악, 즉 CCM(Contemporary Christian Music)은 음악의 한 분야로서, 가사에 기독교 믿음을 직접 또는 간접적으로 담고 있는 현대 대중음악의 한 장르로 여겨지며, 그 밖의 지역에서는 영감적인 음악(Inspirational Music)이라는 표기도 사용한다. ","{'word': 'CCM', 'start_idx': 13, 'end_idx': 15, 'type': 'GEN'}","{'word': '현대 기독교 음악', 'start_idx': 0, 'end_idx': 8, 'type': 'GEN'}",genre:alternate_name
3456,"차일드 발라드에 포함된 것과 같은 기원이 오래된 전승 발라드에 대하여, 대체로 19세기 이후 영국이나 미국에서 실제로 일어난 일들을 노래한 발라드를 ""브로드사이드 발라드""(Broadside Ballade)라 부르고 있다.","{'word': '차일드 발라드', 'start_idx': 0, 'end_idx': 6, 'type': 'GEN'}","{'word': '발라드', 'start_idx': 78, 'end_idx': 80, 'type': 'GEN'}",genre:super_genre
2141,"로큰롤은 다양한 하위장르를 만들어냈으나 초기의 백비트와 같은 특징을 가지지는 않는다. 현재는 이 하위장르들을 통칭 ""록"" 또는 ""록음악""이라 부른다.","{'word': '로큰롤', 'start_idx': 0, 'end_idx': 2, 'type': 'GEN'}","{'word': '록', 'start_idx': 65, 'end_idx': 65, 'type': 'GEN'}",genre:sub_genre
581,적어도 1950년대까지 트로트를 하나의 형식이나 장르로 보지 않았던 것은 분명하다.,"{'word': '1950년대', 'start_idx': 4, 'end_idx': 9, 'type': 'DAT'}","{'word': '트로트', 'start_idx': 13, 'end_idx': 15, 'type': 'GEN'}",no_relation
3293,"초기 예로는 허비 핸콕의 헤드헌터 밴드와 마일즈 데이비스의 On the Corner 앨범이 있는데, 1972년 데이비스는 재즈 펑크에 뛰어들기 시작했고, 록과 펑크를 위한 재즈를 대부분 포기했던 젊은 흑인 관객들과 다시 연결하려는 시도였다고 주장했다.","{'word': '1972년', 'start_idx': 56, 'end_idx': 60, 'type': 'DAT'}","{'word': '허비 핸콕', 'start_idx': 7, 'end_idx': 11, 'type': 'ART'}",no_relation
2070,"1980년대의 팝 록 아티스트로는 스티비 원더, 마이클 잭슨, 필 콜린스, 브라이언 아담스 등이 있으며, 상업적으로 크게 부흥한 시기여서 팝과 록의 혼합이 왕성히 생겨났다. 그로인해 팝 아티스트들의 음악 중 약간의 록적인 요소가 포함되어도 팝 록으로 불리기 시작하였다.","{'word': '필 콜린스', 'start_idx': 35, 'end_idx': 39, 'type': 'ART'}","{'word': '브라이언 아담스', 'start_idx': 42, 'end_idx': 49, 'type': 'ART'}",no_relation
364,"이렇듯, 가사들은 보통 아프리카-아메리칸의 사회에서의 경험, 사고 등을 이야기했는데, 다음은 블라인드 레몬 제퍼슨의 〈Rising High Water Blues〉 (1927)에서 말해주는 1927년 미시시피 대홍수이다.","{'word': 'Rising High Water Blues', 'start_idx': 66, 'end_idx': 88, 'type': 'POH'}","{'word': '1927', 'start_idx': 92, 'end_idx': 95, 'type': 'DAT'}",product:origin
2678,"1947년 비밥 트럼펫 연주자 디지 길레스피와 타악기 연주자 차노 포조의 협연으로 텀블라도라, 봉고 같은 아프로-쿠반 리듬과 악기를 동해안 재즈계에 들여왔다. '만테카'나 '망고 만귀에'와 같은 쿠바 음악과의 초기 재즈 조합은 쿠바 비밥의 경우 흔히 '쿠밥'이라고 불렸다.","{'word': '쿠바 비밥', 'start_idx': 127, 'end_idx': 131, 'type': 'GEN'}","{'word': '쿠밥', 'start_idx': 141, 'end_idx': 142, 'type': 'GEN'}",genre:alternate_name
1950,"시부야계 장르는 1960년대 문화와 서양 팝 뮤직, 그 중에서도 특히 버트 바카라, 브라이언 윌슨, 필 스펙터, 가수 세르주 갱스부르의 오케스트라 음악에 강한 영향을 받았다.","{'word': '브라이언 윌슨', 'start_idx': 47, 'end_idx': 53, 'type': 'ART'}","{'word': '1960년대', 'start_idx': 9, 'end_idx': 14, 'type': 'DAT'}",no_relation
1769,프릿팝은 1990년대 초반의 인디 음악에서 파생했으며 주로 60-70년대 영국 기타 팝 음악의 영향을 많이 받은 이 움직임은 미국에서 건너온 그런지 등의 유행에 대항하며 발생하였다.,"{'word': '프릿팝', 'start_idx': 0, 'end_idx': 2, 'type': 'GEN'}","{'word': '인디 음악', 'start_idx': 16, 'end_idx': 20, 'type': 'GEN'}",genre:super_genre
866,"컨트리에 영향을 받은 음악들, 즉 홍키 통크와 직접적으로 반대되는 것들이 매스 미디어를 통해 복합될 수 있다는 걸 깨달았기 때문에 발달했다.","{'word': '홍키 통크', 'start_idx': 19, 'end_idx': 23, 'type': 'GEN'}","{'word': '컨트리', 'start_idx': 0, 'end_idx': 2, 'type': 'GEN'}",genre:super_genre
3097,"이러한 재즈 음악가들로는 로렌초 티오, 알시데 누네즈 등 다른 커뮤니티 출신 외에도 버디 볼든, 젤리 롤 모턴 등이 포함됐다.","{'word': '재즈', 'start_idx': 4, 'end_idx': 5, 'type': 'GEN'}","{'word': '버디 볼든', 'start_idx': 47, 'end_idx': 51, 'type': 'ART'}",genre:artist
1332,펑크가 나오기 전 대부분의 대중음악은 8분음표 진행에 기반을 두었다.,"{'word': '대중음악', 'start_idx': 15, 'end_idx': 18, 'type': 'GEN'}","{'word': '펑크', 'start_idx': 0, 'end_idx': 1, 'type': 'GEN'}",no_relation
892,이런 요소들로 결국 컨템포러리 컨트리는 팝 음악 시장의 주류로 떠올랐으며 하였으며 다수의 여성 가수들은 크로스오버적인 성공을 활발히 추구하기 시작했다.,"{'word': '팝 음악', 'start_idx': 22, 'end_idx': 25, 'type': 'GEN'}","{'word': '컨템포러리 컨트리', 'start_idx': 11, 'end_idx': 19, 'type': 'GEN'}",genre:sub_genre
1252,"어쿠스틱 피아노는 어스 윈드 앤 파이어의 ""September""와 빌리 프레스턴의 ""Will It Go Round in Circles""를 포함하여 펑크에서 많이 사용된다.","{'word': 'Will It Go Round in Circles', 'start_idx': 46, 'end_idx': 72, 'type': 'POH'}","{'word': '펑크', 'start_idx': 81, 'end_idx': 82, 'type': 'GEN'}",no_relation
1612,"한편, 서부 해안에서는 찰스 라이트 & 와츠 103번가 리듬 밴드가 1967년 첫 앨범을 시작으로 펑크 트랙을 발매하고 있었으며, 1971년 클래식 싱글 ""Express Yourself""로 정점을 찍었다.","{'word': '펑크', 'start_idx': 55, 'end_idx': 56, 'type': 'GEN'}","{'word': '찰스 라이트 & 와츠 103번가', 'start_idx': 13, 'end_idx': 29, 'type': 'ART'}",genre:artist
3286,"이러한 것의 주요 인물들은 주로 뉴욕에 기반을 두고 있었으며 피아니스트 테로니우스 몽크와 버드 파월, 드러머 막스 로치와 케니 클라크, 색소폰 연주자 찰리 파커, 트럼펫 주자 디지 길레스피 등이 포함되어 있었다.","{'word': '버드 파월', 'start_idx': 50, 'end_idx': 54, 'type': 'ART'}","{'word': '뉴욕', 'start_idx': 18, 'end_idx': 19, 'type': 'LOC'}",no_relation
371,이후 60년대가 지나가고 70년대 초반을 넘어섰을 때 진정한 의미의 블루스 록은 거의 자취를 감추고 말았다.,"{'word': '블루스 록', 'start_idx': 38, 'end_idx': 42, 'type': 'GEN'}","{'word': '70년대 초반', 'start_idx': 14, 'end_idx': 20, 'type': 'DAT'}",no_relation
2278,"1960년대 말, 블루스 록과 초기 영국 록 밴드들의 음악을 섞은 블랙 사바스, 레드 제플린같은 밴드들이 하드 록을 탄생시켰다.","{'word': '블랙 사바스', 'start_idx': 37, 'end_idx': 42, 'type': 'ART'}","{'word': '레드 제플린', 'start_idx': 45, 'end_idx': 50, 'type': 'ART'}",artist:member_of
467,"재즈는 초기 뉴올리언스 딕시랜드, 스윙 시대의 빅 밴드 음악, 비밥, 라틴 재즈, 퓨전, 에시드 재즈, 펑크, 힙합, 그리고 당연히 블루스에게도 영향을 미쳤다.","{'word': '펑크', 'start_idx': 58, 'end_idx': 59, 'type': 'GEN'}","{'word': '재즈', 'start_idx': 0, 'end_idx': 1, 'type': 'GEN'}",genre:origin
90,"힙합의 초기에는 팝, 펑크, 레게, 소울, 재즈 등 대중음악에서 추출한 샘플링이나 프로그래밍을 중심으로 한 트랙을 녹음해서 블록파티에 즉흥적인 춤판에 쓰다가, 음악을 틀던 DJ들은 곡 몇 가지 부분에 관중들을 향해 분위기를 맞추기 위해 이런 저런 말들이나 후렴구 도는 미사여구들을 뱉었는데, 그것이 차차 디제이로부터 분화되어 스테이지 위에서 사회를 보는 역할이 따로 만들어져 MC 또는 래퍼가 생겨났고, 그렇게 랩이라는 개념이 탄생하였다.","{'word': '펑크', 'start_idx': 12, 'end_idx': 13, 'type': 'GEN'}","{'word': '랩', 'start_idx': 230, 'end_idx': 230, 'type': 'GEN'}",no_relation
2264,"""Free Bird""는 레너드 스키너드를 대표하는 노래가 되었다.","{'word': 'Free Bird', 'start_idx': 1, 'end_idx': 9, 'type': 'POH'}","{'word': '레너드 스키너드', 'start_idx': 13, 'end_idx': 20, 'type': 'ART'}",product:origin
2406,1950년대 락앤롤 뮤지션인 제리 리 루이스의 실화를 다룬 영화 『Great Balls of Fire』을 보면 기독교가 락앤롤을 얼마나 매도하였는지 알 수 있다.,"{'word': '제리 리 루이스', 'start_idx': 16, 'end_idx': 23, 'type': 'ART'}","{'word': '1950년대', 'start_idx': 0, 'end_idx': 5, 'type': 'DAT'}",no_relation
792,"대표적으로 박재홍의 《유정 천리》와 같은 곡을 비롯해 많은 곡이 1988년까지 발행되지는 않았으나, 인기를 끌어 노래는 불리는 모습이 나타나기도 했다.","{'word': '유정 천리', 'start_idx': 12, 'end_idx': 16, 'type': 'POH'}","{'word': '박재홍', 'start_idx': 6, 'end_idx': 8, 'type': 'ART'}",product:origin
1222,"애리조나주 피닉스에 본사를 둔 다이크와 블레이저스는 1967년 펑키 브로드웨이(Funky Broadway)를 발매했는데, 아마도 이 타이틀에 펑키(funky)라는 단어가 들어간 소울 음악 시대의 첫 음반일 것이다.","{'word': 'funky', 'start_idx': 82, 'end_idx': 86, 'type': 'GEN'}","{'word': '1967년', 'start_idx': 29, 'end_idx': 33, 'type': 'DAT'}",no_relation
2344,1940년대 차세대 재즈 음악인들은 새로운 스타일의 재즈를 꾸준히 발전시켜 나아갔다.,"{'word': '재즈', 'start_idx': 29, 'end_idx': 30, 'type': 'GEN'}","{'word': '1940년대', 'start_idx': 0, 'end_idx': 5, 'type': 'DAT'}",no_relation
447,최근에 들어와 흑인 음악을 통칭하는 표현으로 사용되는 '리듬 앤 블루스'는 사실 1940년대의 일렉트릭 블루스를 의미하는 표현이었다.,"{'word': '리듬 앤 블루스', 'start_idx': 31, 'end_idx': 38, 'type': 'GEN'}","{'word': '흑인 음악', 'start_idx': 8, 'end_idx': 12, 'type': 'GEN'}",genre:alternate_name
2706,베니 굿맨과 진 크루파와 같은 시카고 출신의 다른 사람들은 1930년대에 스윙의 선두 멤버가 되었다.,"{'word': '시카고', 'start_idx': 17, 'end_idx': 19, 'type': 'LOC'}","{'word': '스윙', 'start_idx': 41, 'end_idx': 42, 'type': 'GEN'}",no_relation
2497,로큰롤은 백인 청소년에게 점점 많은 인기를 끌게 되었는데 가수는 주로 흑인이었다. 대표적으로 척 베리와 리틀 리차드가 있었다.,"{'word': '흑인', 'start_idx': 39, 'end_idx': 40, 'type': 'COM'}","{'word': '백인 청소년', 'start_idx': 5, 'end_idx': 10, 'type': 'COM'}",no_relation
12,"이외에도 시대의 아이콘 중 한 명인 퍼렐 윌리엄스와 그를 중심으로 한 N.E.R.D, Cam’ron과 그의 크루 Dipset, West Side와 과거의 힙합을 이야기하며 등장해 일약 스타가 된 더 게임, 남부의 화려한 듀오 아웃캐스트 등이 있다.","{'word': 'Cam’ron', 'start_idx': 48, 'end_idx': 54, 'type': 'ART'}","{'word': 'Dipset', 'start_idx': 63, 'end_idx': 68, 'type': 'ART'}",artist:member_of
663,"1977년에는 그룹사운드 '히식스', '최헌과 검은나비' 등을 결성 해 보컬과 기타리스트로 활동 하던 최헌의 《오동잎》이 후반에 히트 하였고 이성애가 일본에서 데뷔 하면서 트로트를 소개 했다.","{'word': '오동잎', 'start_idx': 62, 'end_idx': 64, 'type': 'POH'}","{'word': '1977년', 'start_idx': 0, 'end_idx': 4, 'type': 'DAT'}",product:origin
1307,"장르에 속하는 행위로는 독일의 밴드 Can, 미국의 아티스트 슬라이 스톤, 조지 클린턴 등이 있으며 1980년대 초 영국과 미국의 포스트펑크 아티스트, 1970년대 후반의 뉴욕 노 웨이브 씬(no wave scene)의 아티스트들도 오넷 콜맨과 같은 인물의 영향을 받아 아방가르드 펑크를 시작했다.","{'word': '아방가르드 펑크', 'start_idx': 151, 'end_idx': 158, 'type': 'GEN'}","{'word': '조지 클린턴', 'start_idx': 42, 'end_idx': 47, 'type': 'ART'}",genre:artist
2605,"아프로 쿠반 재즈는 1940년대 초 마치토 밴드와 그의 아프로 쿠반 음악가 마리오 바우자, 프랭크 그릴로 '마치토'와 함께 뉴욕에서 등장했다.","{'word': '아프로 쿠반 재즈', 'start_idx': 0, 'end_idx': 8, 'type': 'GEN'}","{'word': '뉴욕', 'start_idx': 69, 'end_idx': 70, 'type': 'LOC'}",genre:origin
1521,잼밴드 씬을 통해 순수 펑크 등장이 느껴지면서 1990년대 후반 버클리 음대 졸업생들의 밴드가 결성됐다.,"{'word': '버클리 음대 졸업생들의 밴드', 'start_idx': 36, 'end_idx': 50, 'type': 'COM'}","{'word': '1990년대', 'start_idx': 26, 'end_idx': 31, 'type': 'DAT'}",no_relation
2632,"렌스 블랜차드는 재능 있는 재즈 뮤지션으로 떠올랐고, 이들은 모두 1990년대와 2000년대에 상당한 공헌을 했다.","{'word': '1990년대', 'start_idx': 37, 'end_idx': 42, 'type': 'DAT'}","{'word': '재즈', 'start_idx': 15, 'end_idx': 16, 'type': 'GEN'}",no_relation
1634,"2003년 뉴올리언스 재즈&헤리티지 페스티벌 공연을 위해 결성된 이 밴드는 키보드 연주자 이반 네빌과 기타리스트 이언 네빌이 출연하며, 2011년 합류한 베이스 연주자 2명과 여성 펑크 드러머 니키 글라스피(비욘세 놀스의 월드 투어 밴드 출신, 샘 키닝거 밴드)가 출연한다.","{'word': '이반 네빌', 'start_idx': 50, 'end_idx': 54, 'type': 'ART'}","{'word': '2011년', 'start_idx': 76, 'end_idx': 80, 'type': 'DAT'}",no_relation
2769,"시카고는 ""핫 재즈""를 개발하고 있었고, 올리버 킹은 빌 존슨과 합류했다.","{'word': '핫 재즈', 'start_idx': 6, 'end_idx': 9, 'type': 'GEN'}","{'word': '시카고', 'start_idx': 0, 'end_idx': 2, 'type': 'LOC'}",genre:origin
343,현재까지도 찾아볼수있는 1920년대 이전 음악은 〈Lead Belly〉 와 〈Henry Thomas〉가 있다.,"{'word': 'Henry Thomas', 'start_idx': 43, 'end_idx': 54, 'type': 'POH'}","{'word': '1920년대 이전', 'start_idx': 13, 'end_idx': 21, 'type': 'DAT'}",product:origin
546,가스펠 음악은 1930년대 골든 게이트 콰르텟에 의해 시작되었다.,"{'word': '골든 게이트 콰르텟', 'start_idx': 15, 'end_idx': 24, 'type': 'ART'}","{'word': '가스펠 음악', 'start_idx': 0, 'end_idx': 5, 'type': 'GEN'}",no_relation
1863,"다만, 시부야계 뮤지션들은 자신들이 시부야계로 분류되는 것을 반기지 않는 모습을 보이기도 했다.","{'word': '시부야계 뮤지션', 'start_idx': 4, 'end_idx': 11, 'type': 'COM'}","{'word': '시부야계', 'start_idx': 20, 'end_idx': 23, 'type': 'GEN'}",no_relation
2192,"후에 딥 퍼플이 앨범 Shades of Deep Purple(1968), The Book of Taliesyn (1968), 그리고 Deep Purple을 내면서 하드 록 씬에 등장했다.","{'word': '딥 퍼플', 'start_idx': 3, 'end_idx': 6, 'type': 'ART'}","{'word': '하드 록', 'start_idx': 91, 'end_idx': 94, 'type': 'GEN'}",no_relation
1202,"La Charanga Habanera, Bamboleo 같은 팀바 밴드들은 종종 혼 섹션이나 다른 악기들이 Earth, Wind and Fire, Kool and the Gang 등의 밴드들의 짧은 곡들을 연주한다.","{'word': '팀바', 'start_idx': 34, 'end_idx': 35, 'type': 'GEN'}","{'word': 'Kool and the Gang', 'start_idx': 82, 'end_idx': 98, 'type': 'ART'}",genre:artist
1532,Bootsy Collins 또한 이후의 솔로 앨범에 더 일렉트로 사운드를 접목시키기 시작했다.,"{'word': '일렉트로 사운드', 'start_idx': 31, 'end_idx': 38, 'type': 'POH'}","{'word': 'Bootsy Collins', 'start_idx': 0, 'end_idx': 13, 'type': 'ART'}",product:origin
