id,sentence,subject_entity,object_entity,label
1450,"펑크(funk)는 1960년대 중반 음악가들이 소울, 재즈, 리듬 앤 블루스(R&B)의 혼합을 통해 리드미컬하고 춤추기 쉬운 새로운 형태의 음악을 만들면서 블랙아메리카 커뮤니티에서 유래한 음악 장르다.","{'word': '1960년대 중반', 'start_idx': 10, 'end_idx': 18, 'type': 'DAT'}","{'word': 'funk', 'start_idx': 3, 'end_idx': 6, 'type': 'GEN'}",no_relation
970,이 시대에 레코딩된 음악들 즉 컨트리 뮤직은 옛날 음악이라고 불린다.,"{'word': '옛날 음악', 'start_idx': 25, 'end_idx': 29, 'type': 'GEN'}","{'word': '컨트리 뮤직', 'start_idx': 17, 'end_idx': 22, 'type': 'GEN'}",genre:sub_genre
2039,"1990년대는 주류 음악계가 얼터너티브 열풍을 필두로 상당한 변화를 겪었다. 그 열풍 속에서 팝 음악의 요소와 펑크 록을 혼합한 팝펑크가 생겨났다. 대표적인 아티스트로 그린데이, 오프스프링, 블링크-182 등이 있다.","{'word': '펑크 록', 'start_idx': 62, 'end_idx': 65, 'type': 'GEN'}","{'word': '팝펑크', 'start_idx': 72, 'end_idx': 74, 'type': 'GEN'}",no_relation
2138,"로큰롤의 발생지는 미국 남부 지방으로 알려져 있으며, 초기의 주요 로큰롤 활동이 가장 활발했던 지방이다.","{'word': '미국 남부 지방', 'start_idx': 10, 'end_idx': 17, 'type': 'LOC'}","{'word': '로큰롤', 'start_idx': 0, 'end_idx': 2, 'type': 'GEN'}",no_relation
1240,인디 밴드 릴로 킬리는 다양한 락 스타일을 추구하는 성향에 맞춰 펑크를 앨범 Under the Blacklight의 수록곡 'The Moneymaker'에 접목시켰다.,"{'word': '릴로 킬리', 'start_idx': 6, 'end_idx': 10, 'type': 'ART'}","{'word': '락', 'start_idx': 17, 'end_idx': 17, 'type': 'GEN'}",no_relation
2838,"콜트레인 그룹의 진화는 The John Coltrane Quarty Plays, Living Space and Transition (양쪽 1965년 6월), Newport의 New Thing (1965년 7월), Sun Ship (1965년 8월), First Medcempt (1965년 9월)의 기록을 통해 추적할 수 있다.","{'word': 'First Medcempt', 'start_idx': 140, 'end_idx': 153, 'type': 'POH'}","{'word': '1965년 9월', 'start_idx': 156, 'end_idx': 163, 'type': 'DAT'}",product:origin
2602,스윙은 재즈에 사용되는 아프리카 기반의 리듬 기법 중 가장 중요하고 오래 지속되는 것이다.,"{'word': '재즈', 'start_idx': 4, 'end_idx': 5, 'type': 'GEN'}","{'word': '스윙', 'start_idx': 0, 'end_idx': 1, 'type': 'GEN'}",genre:super_genre
1577,"이 무렵 펑크를 정의한 또 다른 그룹은 이즐레이 브라더스였는데, 그들의 펑키한 1969년 1위 R&B 히트곡 ""It's Your Thing""은 브라운의 재즈 사운드와 지미 핸드릭스의 사이키델릭 록, 그리고 슬라이 & 더 패밀리 스톤과 Mother's Finest 등은 흑인 음악의 돌파구를 예고했다.","{'word': '사이키델릭 록', 'start_idx': 102, 'end_idx': 108, 'type': 'GEN'}","{'word': '지미 핸드릭스', 'start_idx': 93, 'end_idx': 99, 'type': 'ART'}",genre:artist
2173,"1960년대 후반부터 70년대 초반에 황금기를 맞은 하드 록은 이름 그대로 일반적 록 뮤직보다 한층 변이된 사운드의 음악을 지칭한다. 전기 기타의 매우 거칠게 긁어대는듯한 광폭한 사운드와 드럼 세트를 때려 부술 듯한 드럼 연주, 미쳐 울부짖는 보컬을 거대한 음량으로 증폭시켜 한꺼번에 많은 이들에게 들려 주는 것이 특징이었다.","{'word': '하드 록', 'start_idx': 29, 'end_idx': 32, 'type': 'GEN'}","{'word': '록', 'start_idx': 46, 'end_idx': 46, 'type': 'GEN'}",genre:super_genre
2909,재즈는 1920년대 재즈 시대부터 아프리카계 미국인과 유럽계 미국인의 음악적 토대 위에서 결합하고 연결한 전통음악과 대중 사이에서 음악 표현 형태이다.,"{'word': '재즈', 'start_idx': 0, 'end_idx': 1, 'type': 'GEN'}","{'word': '전통음악', 'start_idx': 59, 'end_idx': 62, 'type': 'GEN'}",genre:super_genre
1870,1990년대 아이돌 음악이나 엔카등 전형적인 일본 음악에 반기를 든 젊은 뮤지션들이 서구의 클럽음악인 일렉트로닉 계열이나 프렌치팝 등을 차용하여 시부야계 음악을 만들기 시작하였다.,"{'word': '1990년대', 'start_idx': 0, 'end_idx': 5, 'type': 'DAT'}","{'word': '시부야계 음악', 'start_idx': 81, 'end_idx': 87, 'type': 'GEN'}",no_relation
2748,"블루스는 1860년대 미국 딥사우스에서 아프리카 음악 전통, 아프리카계 미국인의 작업 노래, 영적인 것에 뿌리를 둔 흑인들에 의해 유래된 음악 장르와 음악 형식이다.","{'word': '블루스', 'start_idx': 0, 'end_idx': 2, 'type': 'GEN'}","{'word': '아프리카 음악 전통', 'start_idx': 22, 'end_idx': 31, 'type': 'COM'}",genre:origin
2684,"1947년 비밥 트럼펫 연주자 디지 길레스피와 타악기 연주자 차노 포조의 협연으로 텀블라도라, 봉고 같은 아프로-쿠반 리듬과 악기를 동해안 재즈계에 들여왔다. '만테카'나 '망고 만귀에'와 같은 쿠바 음악과의 초기 재즈 조합은 쿠바 비밥의 경우 흔히 '쿠밥'이라고 불렸다.","{'word': '아프로-쿠반', 'start_idx': 59, 'end_idx': 64, 'type': 'GEN'}","{'word': '쿠밥', 'start_idx': 141, 'end_idx': 142, 'type': 'GEN'}",no_relation
395,"블루스 형식은 재즈, 리듬 앤 블루스, 로큰롤에서도 볼 수 있는데, 주고 받기 형식(Call and Response), 블루스 스케일을 이용한 여러 코드 진행, 두 박자 또는 네 박자의 12마디로 진행하는 블루스가 일반적이며 장조와 단조가 뚜렷하지 않다.","{'word': '블루스', 'start_idx': 0, 'end_idx': 2, 'type': 'GEN'}","{'word': '리듬 앤 블루스', 'start_idx': 12, 'end_idx': 19, 'type': 'GEN'}",no_relation
1318,"배리 화이트의 모든 히트곡, 비두와 칼 더글라스의 ""Kung Fu Fighting"", 도나 서머의 ""Love To Love You Baby"", 다이애나 로스의 ""Love Hangover"", KC와 선샤인 밴드의 ""I'm Your Boogie Man"", ""I'm Every Woman""과 같은 디스코 음악 히트곡들도 있다. 1976년 로즈 로이스는 순수 댄스 펑크 음반 'Car Wash'로 1위 히트곡을 냈고 디스코의 등장에도 펑크는 1980년대 초까지 점점 더 인기를 끌게 되었다.","{'word': '순수 댄스 펑크', 'start_idx': 194, 'end_idx': 201, 'type': 'GEN'}","{'word': 'Love Hangover', 'start_idx': 90, 'end_idx': 102, 'type': 'POH'}",no_relation
1063,"현대의 대중음악은 예술적, 사상적(혹은 종교적) 기준에 의해 기존의 순수 음악 (서양음악, 동양음악, 민족음악)에 대응되는 개념이다.","{'word': '대중음악', 'start_idx': 4, 'end_idx': 7, 'type': 'GEN'}","{'word': '동양음악', 'start_idx': 51, 'end_idx': 54, 'type': 'GEN'}",no_relation
100,투팍과 비기의 다툼은 크게 미국 동부의 힙합과 서부의 힙합간의 대립으로 번지지만 투팍과 비기 모두의 죽음이라는 비극적인 결말로 종결을 맺는다.,"{'word': '미국 동부의 힙합', 'start_idx': 15, 'end_idx': 23, 'type': 'GEN'}","{'word': '투팍', 'start_idx': 0, 'end_idx': 1, 'type': 'ART'}",genre:artist
254,"1920 ~ 30년대에 멤피스 미니, 탬퍼 레드, 빅 빌 브룬지, 존 리 서니 보이 월리엄슨 등은 시카고에서 인기있던 블루스 가수였지만, 제2차 세계대전 이후, 머디 워터스, 하울링 울프, 엘모어 제임스, 리틀 월터 제이콥스 등의 새로운 블루스 맨으로 바뀌었다.","{'word': '블루스', 'start_idx': 133, 'end_idx': 135, 'type': 'GEN'}","{'word': '1920 ~ 30년대', 'start_idx': 0, 'end_idx': 10, 'type': 'DAT'}",no_relation
180,"또한, 이들의 영향을 받은 롤링 스톤스, 비틀즈, 프리티 싱스(Pretty Sings)와 같은 밴드들이 전면에 나서기 시작하면서, ""브리티시 리듬 앤 블루스(British Rhythm and Blues)""로 불리는 영국 특유의 블루스 음악이 록으로 진화하기 시작한 것이다.","{'word': '브리티시 리듬 앤 블루스', 'start_idx': 74, 'end_idx': 86, 'type': 'GEN'}","{'word': '영국', 'start_idx': 120, 'end_idx': 121, 'type': 'LOC'}",genre:origin
1422,1969년에 Jimmy McGriff는 그의 독특한 오르간을 활활 타오르는 혼 섹션 위에 얹은 Electric Funk를 발매했다.,"{'word': 'Electric Funk', 'start_idx': 53, 'end_idx': 65, 'type': 'POH'}","{'word': '1969년', 'start_idx': 0, 'end_idx': 4, 'type': 'DAT'}",product:origin
2194,"후에 딥 퍼플이 앨범 Shades of Deep Purple(1968), The Book of Taliesyn (1968), 그리고 Deep Purple을 내면서 하드 록 씬에 등장했다.","{'word': 'Deep Purple', 'start_idx': 74, 'end_idx': 84, 'type': 'POH'}","{'word': 'The Book of Taliesyn', 'start_idx': 41, 'end_idx': 60, 'type': 'POH'}",no_relation
965,대표적으로 새미 스미스가 크리스오퍼슨의 Help Me Make It Through the Night를 커버해 컨트리 차트 10위권에 진입했다.,"{'word': '크리스오퍼슨', 'start_idx': 14, 'end_idx': 19, 'type': 'ART'}","{'word': '컨트리', 'start_idx': 61, 'end_idx': 63, 'type': 'GEN'}",no_relation
113,"영국과는 달리 60년대의 미국은 반전, 반정부적인 색채의 사회사상이 무르익고 있었다.","{'word': '영국', 'start_idx': 0, 'end_idx': 1, 'type': 'LOC'}","{'word': '60년대', 'start_idx': 8, 'end_idx': 11, 'type': 'DAT'}",no_relation
2306,주다스 프리스트와 레인보우는 파워 메탈의 기초를 만들었다.,"{'word': '레인보우', 'start_idx': 10, 'end_idx': 13, 'type': 'ART'}","{'word': '파워 메탈', 'start_idx': 16, 'end_idx': 20, 'type': 'GEN'}",no_relation
2333,"하드 록은 그 파괴적이고 폭발적인 사운드가 스트레스 가득하여 불만에 시달리는 젊은이들에게 크게 어필하여 크림, 제퍼슨 에어프레인, 마운틴, 레드 제플린, 딥 퍼플 등의 스타 그룹을 탄생시켰다.","{'word': '하드 록', 'start_idx': 0, 'end_idx': 3, 'type': 'GEN'}","{'word': '마운틴', 'start_idx': 73, 'end_idx': 75, 'type': 'ART'}",genre:artist
1579,"이 무렵 펑크를 정의한 또 다른 그룹은 이즐레이 브라더스였는데, 그들의 펑키한 1969년 1위 R&B 히트곡 ""It's Your Thing""은 브라운의 재즈 사운드와 지미 핸드릭스의 사이키델릭 록, 그리고 슬라이 & 더 패밀리 스톤과 Mother's Finest 등은 흑인 음악의 돌파구를 예고했다.","{'word': '슬라이 & 더 패밀리 스톤', 'start_idx': 115, 'end_idx': 128, 'type': 'ART'}","{'word': '1969년', 'start_idx': 44, 'end_idx': 48, 'type': 'DAT'}",no_relation
486,"영국안에서, 밴드들은 전설적인 미국 블루스들을 따라하기 시작했고, 록을 기반으로한 영국 블루스 밴드는 1960년대에 막대한 영향을 끼치게 된다.","{'word': '영국', 'start_idx': 0, 'end_idx': 1, 'type': 'LOC'}","{'word': '1960년대', 'start_idx': 57, 'end_idx': 62, 'type': 'DAT'}",no_relation
93,니키 미나즈는 남성중심적인 힙합에서 여성 래퍼지만 최고에 자리에 존재한다.,"{'word': '니키 미나즈', 'start_idx': 0, 'end_idx': 5, 'type': 'ART'}","{'word': '힙합', 'start_idx': 15, 'end_idx': 16, 'type': 'GEN'}",no_relation
784,"또한 최유나의 《흔적》, 한혜진의 《갈색추억》, 박윤경의 《부초》 등 서정적이고 단조로운 분위기의 트로트들이 주로 인기를 얻기도 하였다.","{'word': '갈색추억', 'start_idx': 20, 'end_idx': 23, 'type': 'POH'}","{'word': '한혜진', 'start_idx': 14, 'end_idx': 16, 'type': 'ART'}",product:origin
982,컨트리 음악은 미국 남부 포크 음악에서 파생되었는데 애팔래치아 산맥과 블루스 그리고 고전 컨트리는 기타와 피들을 사용하는 등 다분히 포크적이다.,"{'word': '블루스', 'start_idx': 39, 'end_idx': 41, 'type': 'GEN'}","{'word': '포크 음악', 'start_idx': 14, 'end_idx': 18, 'type': 'GEN'}",no_relation
1755,"많은 브릿팝 밴드들이 전 세계적으로 큰 상업적 성공을 거두었으나, 다른 스타일로의 이동으로 1990년대 말 그 흐름이 급격히 무너져갔다.","{'word': '브릿팝', 'start_idx': 3, 'end_idx': 5, 'type': 'GEN'}","{'word': '1990년대 말', 'start_idx': 51, 'end_idx': 58, 'type': 'DAT'}",no_relation
2268,"특히, 1960년대 영국적 블루스를 만들어낸 블루스와 로큰롤이 교차할때 영향을 많이 받았다.","{'word': '로큰롤', 'start_idx': 30, 'end_idx': 32, 'type': 'GEN'}","{'word': '1960년대', 'start_idx': 4, 'end_idx': 9, 'type': 'DAT'}",no_relation
703,"1980년대 말에 미국에서 귀국하여 대성공을 이뤄낸 송대관과 태진아는 트로트 신예로 급상승한 설운도, 오랜 무명시절을 거쳐 인기를 얻은 현철과 함께 트로트 사국시대를 형성하여 트로트 음악의 부활을 주도하였다.","{'word': '트로트', 'start_idx': 83, 'end_idx': 85, 'type': 'GEN'}","{'word': '현철', 'start_idx': 76, 'end_idx': 77, 'type': 'ART'}",genre:artist
2857,뉴올리언스는 아프로-캐리비안과 아프리카계 미국 문화 사이의 주요 연결고리였다.,"{'word': '아프로-캐리비안', 'start_idx': 7, 'end_idx': 14, 'type': 'COM'}","{'word': '아프리카계 미국 문화', 'start_idx': 17, 'end_idx': 27, 'type': 'COM'}",no_relation
97,투팍과 비기의 다툼은 크게 미국 동부의 힙합과 서부의 힙합간의 대립으로 번지지만 투팍과 비기 모두의 죽음이라는 비극적인 결말로 종결을 맺는다.,"{'word': '서부의 힙합', 'start_idx': 26, 'end_idx': 31, 'type': 'GEN'}","{'word': '투팍', 'start_idx': 45, 'end_idx': 46, 'type': 'ART'}",genre:artist
197,"윌리 딕슨이란 작곡자가 1948년 유명한 시카고 블루스 연주자인 머디 워터스의 음반 《I Can't Be Satisfied》 (1948)을 듣고 한 말은 이 과정을 생생히 설명해준다. ""주변에 블루스를 부르는 사람은 꽤 있었다. 하지만 그들은 대부분 슬픈 블루스를 노래했다.","{'word': '1948', 'start_idx': 71, 'end_idx': 74, 'type': 'DAT'}","{'word': '머디 워터스', 'start_idx': 36, 'end_idx': 41, 'type': 'ART'}",no_relation
2252,1969년에 발매된 레드 제플린의 기념비적인 첫 앨범은 하드 록의 시작을 나타내는 블루스 록을 싣고 있다. 이들의 앨범은 블루스의 영향이 선명히 드러난다. 유명한 블루스 음악가들의 노래를 개작하거나 커버한 노래도 조금 실렸다.,"{'word': '1969년', 'start_idx': 0, 'end_idx': 4, 'type': 'DAT'}","{'word': '블루스', 'start_idx': 91, 'end_idx': 93, 'type': 'GEN'}",no_relation
1044,"1950년대: 〈봄날은 간다〉(가수:백설희, 손로원 작사/박시춘 작곡)","{'word': '봄날은 간다', 'start_idx': 9, 'end_idx': 14, 'type': 'POH'}","{'word': '백설희', 'start_idx': 20, 'end_idx': 22, 'type': 'ART'}",no_relation
931,40년대 중반 시작된 블루그레스는 50년대 인기를 끌었고 그 사운드는 컨트리의 일부가 되었으며 그들의 발자국을 따라가는 많은 밴드들을 거느리게 되었다.,"{'word': '컨트리', 'start_idx': 39, 'end_idx': 41, 'type': 'GEN'}","{'word': '블루그레스', 'start_idx': 12, 'end_idx': 16, 'type': 'GEN'}",genre:super_genre
3296,"초기 예로는 허비 핸콕의 헤드헌터 밴드와 마일즈 데이비스의 On the Corner 앨범이 있는데, 1972년 데이비스는 재즈 펑크에 뛰어들기 시작했고, 록과 펑크를 위한 재즈를 대부분 포기했던 젊은 흑인 관객들과 다시 연결하려는 시도였다고 주장했다.","{'word': 'On the Corner', 'start_idx': 33, 'end_idx': 45, 'type': 'POH'}","{'word': '재즈', 'start_idx': 96, 'end_idx': 97, 'type': 'GEN'}",no_relation
1617,"한편, 서부 해안에서는 찰스 라이트 & 와츠 103번가 리듬 밴드가 1967년 첫 앨범을 시작으로 펑크 트랙을 발매하고 있었으며, 1971년 클래식 싱글 ""Express Yourself""로 정점을 찍었다.","{'word': 'Express Yourself', 'start_idx': 87, 'end_idx': 102, 'type': 'POH'}","{'word': '서부 해안', 'start_idx': 4, 'end_idx': 8, 'type': 'LOC'}",no_relation
1002,홍키 통크는 로커빌리와 컨트리 팝이 주류 팬들을 휘어잡은만큼은 아니었지만 그 사운드는 다가올 60년대에 컨트리 팝에 대항하는 장르가 되었다.,"{'word': '컨트리 팝', 'start_idx': 58, 'end_idx': 62, 'type': 'GEN'}","{'word': '로커빌리', 'start_idx': 7, 'end_idx': 10, 'type': 'GEN'}",no_relation
2423,이들의 장르를 로커빌리 라고 하는데 이것은 로큰롤과 컨트리 송의 진화 형태인 힐빌리를 합친 말이다. 이런 음악들은 미국 주류 사회를 뒤흔들었다.,"{'word': '컨트리 송', 'start_idx': 29, 'end_idx': 33, 'type': 'GEN'}","{'word': '로큰롤', 'start_idx': 24, 'end_idx': 26, 'type': 'GEN'}",genre:sub_genre
3033,"재즈 펑크는 또한 전통적인 아프리카 음악, 아프로-쿠바 리듬, 자메이카 레게의 영향을 받고, 특히 킹스턴 밴드의 리더 소니 브래드쇼의 영향을 받는다.","{'word': '재즈 펑크', 'start_idx': 0, 'end_idx': 4, 'type': 'GEN'}","{'word': '아프리카 음악', 'start_idx': 15, 'end_idx': 21, 'type': 'GEN'}",genre:super_genre
1025,"80년대 말과 90년대 초에 컨템포러리 컨트리는 비록 더 많은 팬 층을 거느렸고, 가스 브룩스와 그의 잠재적인 ‘록’스러움이 적지 않았음에도 여전히 핵심은 컨트리와 같았다.","{'word': '컨템포러리 컨트리', 'start_idx': 16, 'end_idx': 24, 'type': 'GEN'}","{'word': '록', 'start_idx': 63, 'end_idx': 63, 'type': 'GEN'}",no_relation
3095,"이러한 재즈 음악가들로는 로렌초 티오, 알시데 누네즈 등 다른 커뮤니티 출신 외에도 버디 볼든, 젤리 롤 모턴 등이 포함됐다.","{'word': '재즈', 'start_idx': 4, 'end_idx': 5, 'type': 'GEN'}","{'word': '로렌초 티오', 'start_idx': 14, 'end_idx': 19, 'type': 'ART'}",genre:artist
1411,DU's의 매우 강력한 펑크 앨범은 1996년 발매된 Future Rhythm이었다.,"{'word': ""DU's"", 'start_idx': 0, 'end_idx': 3, 'type': 'ART'}","{'word': 'Future Rhythm', 'start_idx': 30, 'end_idx': 42, 'type': 'POH'}",producer:product
2174,"레너드 스키너드의 싱글 ""Free Bird""로 전국적인 관심을 끌었다. ","{'word': '레너드 스키너드', 'start_idx': 0, 'end_idx': 7, 'type': 'ART'}","{'word': 'Free Bird', 'start_idx': 14, 'end_idx': 22, 'type': 'POH'}",producer:product
3336,"19세기 초 동안 점점 더 많은 수의 흑인 음악가들이 유럽 악기, 특히 바이올린을 배우는데, 그들은 자신들의 댄스에서 유럽의 댄스 음악을 패러디하곤 했다.","{'word': '유럽의 댄스 음악', 'start_idx': 66, 'end_idx': 74, 'type': 'GEN'}","{'word': '유럽', 'start_idx': 30, 'end_idx': 31, 'type': 'LOC'}",genre:origin
983,컨트리 음악은 미국 남부 포크 음악에서 파생되었는데 애팔래치아 산맥과 블루스 그리고 고전 컨트리는 기타와 피들을 사용하는 등 다분히 포크적이다.,"{'word': '고전 컨트리', 'start_idx': 47, 'end_idx': 52, 'type': 'GEN'}","{'word': '포크 음악', 'start_idx': 14, 'end_idx': 18, 'type': 'GEN'}",no_relation
1682,"네거스, 키스 Music Genres and Corporate Cultures Routledge, 1999. ISBN 0-415-17399-X","{'word': 'Music Genres and Corporate Cultures Routledge', 'start_idx': 8, 'end_idx': 52, 'type': 'POH'}","{'word': '1999', 'start_idx': 55, 'end_idx': 58, 'type': 'DAT'}",product:origin
987,보통 시골의 음악으로 생각되기 쉽지만 홍키 통크는 사실 남부 도시로 이주한 시골 이민자의 결과라고 볼 수 있으며 특히 텍사스에서 그랬다.,"{'word': '텍사스', 'start_idx': 66, 'end_idx': 68, 'type': 'LOC'}","{'word': '남부 도시', 'start_idx': 31, 'end_idx': 35, 'type': 'LOC'}",no_relation
294,머디 워터스와 같은 아티스트에 의한 '활기찬 블루스'는 리듬 앤 블루스로 불리었다.,"{'word': '머디 워터스', 'start_idx': 0, 'end_idx': 5, 'type': 'ART'}","{'word': '활기찬 블루스', 'start_idx': 21, 'end_idx': 27, 'type': 'POH'}",no_relation
1168,디스코 음악은 펑크 덕분이었다.,"{'word': '펑크', 'start_idx': 8, 'end_idx': 9, 'type': 'GEN'}","{'word': '디스코 음악', 'start_idx': 0, 'end_idx': 5, 'type': 'GEN'}",no_relation
894,컨템포러리 컨트리 사운드는 고전 홍키 통크에 중점을 두었지만 새로운 기술과 장비의 장점을 받아들여 순수한 컨트리 뮤직과 비슷한 사운드를 낼 수 있게 되었다.,"{'word': '컨트리 뮤직', 'start_idx': 59, 'end_idx': 64, 'type': 'GEN'}","{'word': '컨템포러리 컨트리 사운드', 'start_idx': 0, 'end_idx': 12, 'type': 'GEN'}",genre:sub_genre
2286,KISS는 라이브 메탈 앨범의 초기 모델이 되는 더블 라이브 앨범 Alive!로 상업적인 성공을 거두었다.,"{'word': 'KISS', 'start_idx': 0, 'end_idx': 3, 'type': 'ART'}","{'word': 'Alive!', 'start_idx': 37, 'end_idx': 42, 'type': 'POH'}",producer:product
1864,"다만, 시부야계 뮤지션들은 자신들이 시부야계로 분류되는 것을 반기지 않는 모습을 보이기도 했다.","{'word': '시부야계', 'start_idx': 20, 'end_idx': 23, 'type': 'GEN'}","{'word': '시부야계 뮤지션', 'start_idx': 4, 'end_idx': 11, 'type': 'COM'}",no_relation
2937,해리 코닉 주니어는 10살 때 처음으로 녹음한 것을 시작으로 스트레이드 피아노와 그의 고향인 뉴올리언스의 딕시랜드 재즈를 연주하기 시작했다.,"{'word': '해리 코닉 주니어', 'start_idx': 0, 'end_idx': 8, 'type': 'ART'}","{'word': '딕시랜드 재즈', 'start_idx': 59, 'end_idx': 65, 'type': 'GEN'}",no_relation
611,1982년에 설운도는 KBS 신인탄생으로 데뷔하였고 데뷔곡 《잃어버린 30년》이 이산가족 찾기 운동의 주제가로 쓰여 많은 사랑을 받았다.,"{'word': '설운도', 'start_idx': 7, 'end_idx': 9, 'type': 'ART'}","{'word': '1982년', 'start_idx': 0, 'end_idx': 4, 'type': 'DAT'}",no_relation
1381,"1990년까지, 몇몇 쿠바 밴드들은 펑크와 힙합 요소들을 그들의 배치에 포함시켰고, 미국의 드럼 세트, 색소폰, 그리고 두 개의 키보드 형식을 가진 전통적인 구성에 의해 확장되었다.","{'word': '펑크', 'start_idx': 20, 'end_idx': 21, 'type': 'GEN'}","{'word': '힙합', 'start_idx': 24, 'end_idx': 25, 'type': 'GEN'}",no_relation
2559,"즉흥 연주, 복잡한 리듬, 조화로운 질감과 같은 재즈 요소들이 장르에 도입되어 결과적으로 새로운 청취자들에게 큰 영향을 미쳤으며 어떤 면에서는 전통주의자들이 리얼 재즈라고 부르는 것(bebop, cool, modal jazz)과 반드시 관련이 없는 새로운 세대에 대한 재즈의 다재다능성을 유지시켰다.","{'word': '리얼 재즈', 'start_idx': 88, 'end_idx': 92, 'type': 'GEN'}","{'word': '재즈', 'start_idx': 27, 'end_idx': 28, 'type': 'GEN'}",genre:super_genre
2179,한편 블랙 사바스는 주다스 프리스트와 레인보우의 헤비 메탈 노선을 따라 Technical Ecstasy를 내면서 그들 초기 음악의 어두움을 지워버렸다.,"{'word': '헤비 메탈', 'start_idx': 27, 'end_idx': 31, 'type': 'GEN'}","{'word': 'Technical Ecstasy', 'start_idx': 40, 'end_idx': 56, 'type': 'POH'}",no_relation
165,"남북전쟁 이후, 농장에서 흑인 노예들에 의해 불리었던 할러, 혹은 노동요로 불리는 음악들은 농장제가 없어지면서 동시에 소멸되었지만, 아프리카적 요소들을 고스란히 도입하고 있던 이러한 음악들이 민스트럴 쇼, 교회에서 불리던 복음성가 등과 합쳐지면서 렉타임, 부기우기 등으로 발전 되었고, 블루스의 원류를 형성하는 음악이 된 것이다.","{'word': '남북전쟁 이후', 'start_idx': 0, 'end_idx': 6, 'type': 'DAT'}","{'word': '렉타임', 'start_idx': 138, 'end_idx': 140, 'type': 'GEN'}",no_relation
2538,"얼터너티브라고 불리거나 불린 적이 있었던 밴드 및 가수로는 콜드플레이, 오아시스, 존레논, 뮤즈, 보아, 퀸, 마룬 5, 이매진 드래곤스, 제이슨 므라즈, 찰리 푸스, 혁오, 넬 등이 있다.","{'word': '얼터너티브', 'start_idx': 0, 'end_idx': 4, 'type': 'GEN'}","{'word': '찰리 푸스', 'start_idx': 87, 'end_idx': 91, 'type': 'ART'}",genre:artist
934,"세부 장르로는 블루그레스 가스펠과 컨템포러리 블루그레스, 프로그레시브 블루그레스, 전통 블루그레스가 있다.","{'word': '전통 블루그레스', 'start_idx': 46, 'end_idx': 53, 'type': 'GEN'}","{'word': '블루그레스 가스펠', 'start_idx': 8, 'end_idx': 16, 'type': 'GEN'}",no_relation
2460,"하지만 로버트 존슨이 약혼녀에게 독살 당하고 그가 개발한 리듬은 오랫동안 알려지지 않다가, 그에게 영향을 받은 50년대 척베리 등과 같은 블루스 뮤지션들이 그의 리듬을 발전시켜 락앤롤의 선구적인 역할을 한다. ","{'word': '50년대', 'start_idx': 62, 'end_idx': 65, 'type': 'DAT'}","{'word': '척베리', 'start_idx': 67, 'end_idx': 69, 'type': 'ART'}",no_relation
25,"카니예 웨스트는 그의 음악과 패션, 여러 구설수를 낳은 행동과 함께 대중문화 아이콘으로 자리매김한다.","{'word': '대중문화 아이콘', 'start_idx': 38, 'end_idx': 45, 'type': 'POH'}","{'word': '카니예 웨스트', 'start_idx': 0, 'end_idx': 6, 'type': 'ART'}",no_relation
1224,"Dumpstaphunk는 펑크의 뉴올리언즈 전통에 바탕을 두고 있으며, 그들의 거칠고 낮은 그루브와 소울풀한 4부 음성으로 이루어져 있다.","{'word': '펑크', 'start_idx': 14, 'end_idx': 15, 'type': 'GEN'}","{'word': 'Dumpstaphunk', 'start_idx': 0, 'end_idx': 11, 'type': 'ART'}",genre:artist
