id,sentence,subject_entity,object_entity,label
3237,1969년 데이비스는 자신의 첫 퓨전 앨범으로 여겨질 수 있는 In a Silent Way로 재즈에 대한 전자 악기 접근법을 완전히 수용했다.,"{'word': 'In a Silent Way', 'start_idx': 35, 'end_idx': 49, 'type': 'POH'}","{'word': '데이비스', 'start_idx': 6, 'end_idx': 9, 'type': 'ART'}",product:origin
550,"일렉트릭 블루스는 1940년대에 주로 시카고 남부의 바나 클럽에서 생겨났는데, 이 새로운 스타일은 시카고, 맴피스, 디트로이트 등지에서 유명해지기 시작했다.","{'word': '시카고 남부의 바나 클럽', 'start_idx': 21, 'end_idx': 33, 'type': 'LOC'}","{'word': '일렉트릭 블루스', 'start_idx': 0, 'end_idx': 7, 'type': 'GEN'}",no_relation
1724,"사이키델릭 록은 1960년대 중반 영국과 미국에서 비틀즈와 버즈 등의 밴드들이 처음 시도했으며, 비틀즈의 Rain, I'm Only Sleeping, Tomorrow Never Knows, 버즈의 Eight Miles High 같은 곡들이 그 시초이다.","{'word': '사이키델릭 록', 'start_idx': 0, 'end_idx': 6, 'type': 'GEN'}","{'word': '영국', 'start_idx': 19, 'end_idx': 20, 'type': 'LOC'}",genre:origin
1340,펑크잼은 1990년대에 등장한 퓨전 음악 장르다.,"{'word': '퓨전 음악', 'start_idx': 17, 'end_idx': 21, 'type': 'GEN'}","{'word': '펑크잼', 'start_idx': 0, 'end_idx': 2, 'type': 'GEN'}",genre:sub_genre
1633,"2003년 뉴올리언스 재즈&헤리티지 페스티벌 공연을 위해 결성된 이 밴드는 키보드 연주자 이반 네빌과 기타리스트 이언 네빌이 출연하며, 2011년 합류한 베이스 연주자 2명과 여성 펑크 드러머 니키 글라스피(비욘세 놀스의 월드 투어 밴드 출신, 샘 키닝거 밴드)가 출연한다.","{'word': '2011년', 'start_idx': 76, 'end_idx': 80, 'type': 'DAT'}","{'word': '2003년', 'start_idx': 0, 'end_idx': 4, 'type': 'DAT'}",no_relation
3151,뉴올리언스 밴드는 흑인 아이들이 가난에서 벗어날 수 있도록 도와주면서 도시의 뚜렷한 사운드와 함께 플레이어를 프로 재즈의 세계에 기부한다.,"{'word': '뉴올리언스 밴드', 'start_idx': 0, 'end_idx': 7, 'type': 'ART'}","{'word': '프로 재즈', 'start_idx': 61, 'end_idx': 65, 'type': 'GEN'}",no_relation
1624,"이런 음악 장르에 대한 대부분의 글은 전통적으로 지미 헨드릭스, 조지 클린턴(Parliament), 베이시스트 래리 그레이엄 같은 남성 아티스트를 록 음악 감성의 형성에 있어 트렌드 중심으로 배치해 왔다.","{'word': '남성 아티스트', 'start_idx': 73, 'end_idx': 79, 'type': 'POH'}","{'word': '래리 그레이엄', 'start_idx': 62, 'end_idx': 68, 'type': 'ART'}",no_relation
2926,"비밥은 1940년대에 등장하여 재즈를 춤추기 쉬운 대중음악에서 더욱 도전적인 ""뮤지션의 음악""으로 변화하였다.","{'word': '비밥', 'start_idx': 0, 'end_idx': 1, 'type': 'GEN'}","{'word': '재즈', 'start_idx': 17, 'end_idx': 18, 'type': 'GEN'}",genre:super_genre
1265,펑크 샘플과 브레이크비트는 힙합과 일렉트로닉 댄스 음악에서 광범위하게 사용되어 왔다.,"{'word': '일렉트로닉 댄스 음악', 'start_idx': 19, 'end_idx': 29, 'type': 'GEN'}","{'word': '힙합', 'start_idx': 15, 'end_idx': 16, 'type': 'GEN'}",no_relation
2378,그리고 영국으로 건너가 리버풀 등 항구 도시에서 유행을 하게 되었다. 로큰롤은 재즈와 결합하여 스키플 사운드를 만들어냈는데 대표적으로 비틀즈가 있었다.,"{'word': '스키플 사운드', 'start_idx': 53, 'end_idx': 59, 'type': 'GEN'}","{'word': '재즈', 'start_idx': 44, 'end_idx': 45, 'type': 'GEN'}",genre:super_genre
491,"1960년대 초, 영국인과 블루스 뮤지션들은 미국 블루스 록 퓨전 연주자들의 규모에 놀랐는데, 더 도어스, 캔디드 히트, 초기 제퍼슨 에어플레인, 제니스 조플린, 조니 윈터, J. 게일 밴드, Ry 코더, 올먼 브러더스 밴드 그리고 블루스 록 연주자인 지미 헨드릭스는 당시 시장에선 희귀했다.","{'word': '블루스 록', 'start_idx': 130, 'end_idx': 134, 'type': 'GEN'}","{'word': '초기 제퍼슨 에어플레인', 'start_idx': 68, 'end_idx': 79, 'type': 'ART'}",genre:artist
2502,비틀즈의 영향을 받은 밥 딜런이 포크 송과 로큰롤 사운드를 절묘하게 결합시킨 포크 록을 만들어냈다.,"{'word': '포크 록', 'start_idx': 43, 'end_idx': 46, 'type': 'GEN'}","{'word': '밥 딜런', 'start_idx': 12, 'end_idx': 15, 'type': 'ART'}",genre:artist
3351,"존 스톰 로버츠는 음악 장르인 하바네라가 ""첫 래그타임이 나오기 20년 전에 미국을 리메이크했다""고 말한다.","{'word': '미국', 'start_idx': 43, 'end_idx': 44, 'type': 'LOC'}","{'word': '존 스톰 로버츠', 'start_idx': 0, 'end_idx': 7, 'type': 'ART'}",no_relation
2990,"뉴올리언스 재즈는 1910년대 초반에 시작했고, 이전의 브라스 밴드 행진곡, 프랑스식 사중주, 이중주, 래그타임, 블루스와 함께 집단적인 즉흥 연주를 결합하였다.","{'word': '뉴올리언스 재즈', 'start_idx': 0, 'end_idx': 7, 'type': 'GEN'}","{'word': '이중주', 'start_idx': 53, 'end_idx': 55, 'type': 'GEN'}",genre:super_genre
228,흑인들은 전기 증폭에 의해 마침내 컨트리 블루스에서는 없던 리듬을 만들게 된다. 리듬 앤 블루스는 그렇게 생성된 것이었다.,"{'word': '리듬 앤 블루스', 'start_idx': 45, 'end_idx': 52, 'type': 'GEN'}","{'word': '흑인', 'start_idx': 0, 'end_idx': 1, 'type': 'COM'}",genre:origin
636,1990년대 중반에 댄스가수였던 김혜연이 등장하여 기존의 정통 트로트에 여러 음악적 요소를 가미 시킨 세미 트로트를 선보였다.,"{'word': '정통 트로트', 'start_idx': 32, 'end_idx': 37, 'type': 'GEN'}","{'word': '세미 트로트', 'start_idx': 57, 'end_idx': 62, 'type': 'GEN'}",genre:sub_genre
2316,딥 퍼플은 레드 제플린과 블랙 사바스와 함께 최초의 하드 록 밴드로 불린다.,"{'word': '블랙 사바스', 'start_idx': 14, 'end_idx': 19, 'type': 'ART'}","{'word': '하드 록', 'start_idx': 29, 'end_idx': 32, 'type': 'GEN'}",no_relation
586,1966년에는 《동숙의 노래》로 데뷔한 문주란이 있었는데 허스키한 목소리가 매력적인 가수로 손꼽혔다.,"{'word': '문주란', 'start_idx': 22, 'end_idx': 24, 'type': 'ART'}","{'word': '1966년', 'start_idx': 0, 'end_idx': 4, 'type': 'DAT'}",no_relation
835,"대부분의 음악 장르의 앨범 판매율은 2005년 부터 지속적으로 감소 하고있지만, 2006년 컨트리 음악은 미국 판매량이 3천 6백 만 장을 기록하며 전년대비 17.7%나 오르며 최고의 한 해를 보냈다.","{'word': '미국', 'start_idx': 59, 'end_idx': 60, 'type': 'LOC'}","{'word': '컨트리 음악', 'start_idx': 51, 'end_idx': 56, 'type': 'GEN'}",no_relation
1263,"트롬본 연주자 프레드 웨슬리와 색소폰 연주자 피 위 엘리스와 메서 파커는 제임스 브라운, 조지 클린턴, 프린스와 함께 활동한 경험이 있는 펑크 음악 장르에서 가장 주목할 만한 음악가 중 한 명이라 할 수 있다.","{'word': '펑크', 'start_idx': 77, 'end_idx': 78, 'type': 'GEN'}","{'word': '프린스', 'start_idx': 58, 'end_idx': 60, 'type': 'ART'}",no_relation
458,"훗날, 존 리 후커는 자신의 블루스와 어린 백인 뮤지션을 미숙한 록과 섞어서 새로운 음악 스타일을 만들게된다. 바로 1971년 앨범 《Endless Boogie》다.","{'word': '블루스', 'start_idx': 16, 'end_idx': 18, 'type': 'GEN'}","{'word': '존 리 후커', 'start_idx': 4, 'end_idx': 9, 'type': 'ART'}",genre:artist
1031,"기본적인 홍키 통크 사운드는 어쿠스틱, 일렉 기타, 피들, 베이스 기타, 스틸 기타 등이 특징인데 그것은 하와이의 음악에서 건너온 것이다.","{'word': '홍키 통크 사운드', 'start_idx': 5, 'end_idx': 13, 'type': 'GEN'}","{'word': '하와이의 음악', 'start_idx': 59, 'end_idx': 65, 'type': 'GEN'}",genre:super_genre
2824,"1980년대 마일즈 데이비스의 음악조차도 확실히 융합을 이루기는 했지만, 1970년대 중반의 그의 추상적인 작품보다 훨씬 더 접근하기 쉽고 인식적인 접근법을 채택했다.","{'word': '마일즈 데이비스', 'start_idx': 7, 'end_idx': 14, 'type': 'ART'}","{'word': '1970년대 중반', 'start_idx': 41, 'end_idx': 49, 'type': 'DAT'}",no_relation
1204,펑크는 1990년대 후반과 2000년대의 특정 아티스트들의 주요 요소다.,"{'word': '특정 아티스트들', 'start_idx': 23, 'end_idx': 30, 'type': 'COM'}","{'word': '1990년대 후반과 2000년대', 'start_idx': 4, 'end_idx': 20, 'type': 'DAT'}",no_relation
2894,재즈(Jazz)는 19세기 말~20세기 초 미국 뉴올리언스 아프리카계 미국인 사회에서 유래된 음악 장르로 블루스와 래그타임에 뿌리를 둔다.,"{'word': '미국 뉴올리언스', 'start_idx': 24, 'end_idx': 31, 'type': 'LOC'}","{'word': '블루스', 'start_idx': 59, 'end_idx': 61, 'type': 'GEN'}",no_relation
3402,한편 레게 음반 《클렌시 에클스》를 제작한 스티브 버로우는 레게라는 말이 파트와어 스트레게(Streggae)에서 나왔다고 말한다.,"{'word': '레게', 'start_idx': 33, 'end_idx': 34, 'type': 'GEN'}","{'word': '스트레게', 'start_idx': 46, 'end_idx': 49, 'type': 'POH'}",genre:origin
2367,"1939년에 발매된 콜먼 호킨스의 ""육체와 영혼""이 비밥의 원조이다.","{'word': '육체와 영혼', 'start_idx': 20, 'end_idx': 25, 'type': 'POH'}","{'word': '1939년', 'start_idx': 0, 'end_idx': 4, 'type': 'DAT'}",product:origin
2509,록 음악(영어: Rock music)은 1950년대 초 미국에서 생겨난 대중음악의 한 형식이다.,"{'word': '1950년대 초', 'start_idx': 22, 'end_idx': 29, 'type': 'DAT'}","{'word': 'Rock music', 'start_idx': 9, 'end_idx': 18, 'type': 'GEN'}",no_relation
2723,1865년 노예제 폐지는 해방된 아프리카계 미국인들의 교육에 새로운 기회를 가져다 주었다.,"{'word': '1865년', 'start_idx': 0, 'end_idx': 4, 'type': 'DAT'}","{'word': '노예제 폐지', 'start_idx': 6, 'end_idx': 11, 'type': 'POH'}",no_relation
650,"1922년 ∼ 1930년 사이 《사의 찬미》의 윤심덕을 비롯해 《낙화유수》(김서정 작사/작곡)의 이정숙과 《봄노래 부르자》(김서정 작사/작곡)의 채규엽 및 세동무의 채동원, 그리고 《암로(暗路)》의 김연실 등이 대표적인 가수였다.","{'word': '윤심덕', 'start_idx': 26, 'end_idx': 28, 'type': 'ART'}","{'word': '사의 찬미', 'start_idx': 18, 'end_idx': 22, 'type': 'POH'}",producer:product
347,"또한, 오늘날 블루스의 기본적인 형태인 12마디 블루스 역시 이 시기에 나타난 것으로 보이지만, 당시에 주로 쓰이던 형태는 12마디 블루스가 아닌, 8마디 블루스가 2번 나열되는 형태였다.","{'word': '블루스', 'start_idx': 8, 'end_idx': 10, 'type': 'GEN'}","{'word': '12마디 블루스', 'start_idx': 22, 'end_idx': 29, 'type': 'GEN'}",genre:sub_genre
1802,"미국의 빌보드 지에는 CCM이 ""크리스천 앨범"", ""크리스천 송""으로 분류되고 있다. ","{'word': '미국', 'start_idx': 0, 'end_idx': 1, 'type': 'LOC'}","{'word': 'CCM', 'start_idx': 12, 'end_idx': 14, 'type': 'GEN'}",no_relation
1413,1970년대 후반부터 프린스는 제임스와의 비슷함을 벗고 역동적인 구성을 사용했다.,"{'word': '프린스', 'start_idx': 12, 'end_idx': 14, 'type': 'ART'}","{'word': '1970년대 후반', 'start_idx': 0, 'end_idx': 8, 'type': 'DAT'}",no_relation
495,"이러한 도시풍의 블루스를 어반 블루스라 부르는데, 이 어반 블루스의 발전에 가장 큰 역할을 한 곳은 시카고였다.","{'word': '어반 블루스', 'start_idx': 14, 'end_idx': 19, 'type': 'GEN'}","{'word': '도시풍의 블루스', 'start_idx': 4, 'end_idx': 11, 'type': 'POH'}",genre:origin
941,팝’스럽게 변하는 유행은 70년대와 80년대 계속 진행되었고 90년대 컨템포러리 컨트리 가스펠은 CCM의 어덜트 컨템포러리적 성향에서 정체성을 찾았다.,"{'word': '컨템포러리 컨트리 가스펠', 'start_idx': 40, 'end_idx': 52, 'type': 'GEN'}","{'word': 'CCM', 'start_idx': 55, 'end_idx': 57, 'type': 'GEN'}",no_relation
3066,"존 조른은 펑크 록에서 유행하고 있는 속도와 불협화음에 중점을 두고, Spy vs. Spy의 발매와 함께 이것을 프리 재즈에 접목시켰다.","{'word': '프리 재즈', 'start_idx': 63, 'end_idx': 67, 'type': 'GEN'}","{'word': '존 조른', 'start_idx': 0, 'end_idx': 3, 'type': 'ART'}",genre:artist
862,"1920년대 최초의 상업적 목적으로 레코딩된 컨트리 음악은 ""Sallie Gooden""이다.","{'word': 'Sallie Gooden', 'start_idx': 34, 'end_idx': 46, 'type': 'POH'}","{'word': '1920년대', 'start_idx': 0, 'end_idx': 5, 'type': 'DAT'}",product:origin
2747,"블루스는 1860년대 미국 딥사우스에서 아프리카 음악 전통, 아프리카계 미국인의 작업 노래, 영적인 것에 뿌리를 둔 흑인들에 의해 유래된 음악 장르와 음악 형식이다.","{'word': '블루스', 'start_idx': 0, 'end_idx': 2, 'type': 'GEN'}","{'word': '미국 딥사우스', 'start_idx': 12, 'end_idx': 18, 'type': 'LOC'}",genre:origin
1889,"시부야계 관련 뮤지션에는 피치카토 파이브, 고니시 야스하루, 판타스틱 플라스틱 머신, 캡슐, 나카타 야스타카, COLTEMONIKHA, Perfume, 고시지마 도시코, FreeTEMPO, DJ KAWASAKI, DJ Okawari, Daishi Dance, 800 Cherries, Buffalo Daughter, 세씨, 씨보 마토, 차피, Chocolat, Copter4016882, 코넬리우스, Cubismo Grafico, Cymbals, Dahlia, 플리퍼스 기타, Gulliver, Hazel Nuts Chocolate, Hi-Posi, Hideki Kaji, Kahimi Karie, Kiiiiiii, Kirinji, Macdonald Duck Eclair, m-flo, Misswonda, Nagisa Cosmetic, 마키 노미야, 카리야 노모토, 오자와 겐지, 오리지널 러브 (다지마 다카오), P&ART SASANOOOHA, 패리스 매치, Pine*AM, Plus-Tech Squeeze Box, 시이나 켄스케, 사운드 호라이즌, 스트로베리 머신, 미네카와 다카코, 오에 다쓰야 (캡틴 펑크), Towa Tei, 타코반장, 오노 요코, 스나하라 요시노리, 유카리 프레시 등이 있다. ","{'word': '시부야계', 'start_idx': 0, 'end_idx': 3, 'type': 'GEN'}","{'word': '씨보 마토', 'start_idx': 181, 'end_idx': 185, 'type': 'ART'}",genre:artist
3416,"음반에서 레게라는 용어가 처음 사용된 것은 자메이카의 음악 그룹인 투츠 앤 더 마이탈스의 록스테디 음반 ""Do the Reggay""로 이 음반은 1968년 발매되어 큰 성공을 거두었다. ","{'word': '1968년', 'start_idx': 81, 'end_idx': 85, 'type': 'DAT'}","{'word': '자메이카', 'start_idx': 24, 'end_idx': 27, 'type': 'LOC'}",no_relation
2201,또한 1974년에 퀸은 그들의 세 번째 앨범 Sheer Heart Attack을 발매했다. 이 앨범의 여덟 번째 트랙 Stone Cold Crazy는 스피드 메탈과 스래시 메탈의 최초의 예가 되었다. 이 노래는 후에 메탈리카와 메가데스 등의 음악가들에게 영향을 주었다.,"{'word': '스래시 메탈', 'start_idx': 92, 'end_idx': 97, 'type': 'GEN'}","{'word': '퀸', 'start_idx': 10, 'end_idx': 10, 'type': 'ART'}",genre:artist
1286,1970년 슬라이 앤 더 패밀리 스톤의 'Thank You(Falettinme Be Mice Elf Agin)'가 1971년 'Family Affair'와 마찬가지로 차트 1위에 올랐다.,"{'word': 'Family Affair', 'start_idx': 71, 'end_idx': 83, 'type': 'POH'}","{'word': '1971년', 'start_idx': 64, 'end_idx': 68, 'type': 'DAT'}",product:origin
3133,"1930년대는 인기 있는 스윙 빅 밴드에 속했고, 이 밴드의 리더만큼 유명해진 몇몇 거장들이 있었다. ""빅"" 재즈 밴드를 개발하는 주요 인물들은 베이시, 캡 캘러웨이, 지미와 토미 도시, 듀크 엘링턴, 베니 굿맨, 플레처 헨더슨, 얼 하인즈, 해리 제임스, 짐미 룬스포드, 글렌 밀러, 아티 쇼 등이 있다.","{'word': '재즈', 'start_idx': 61, 'end_idx': 62, 'type': 'GEN'}","{'word': '짐미 룬스포드', 'start_idx': 144, 'end_idx': 150, 'type': 'ART'}",genre:artist
1963,"1965년에 <미스터 탬버린 맨>이 히트한 이래, 이러한 스타일이 널리 시도되기에 이르렀다. ","{'word': '미스터 탬버린 맨', 'start_idx': 8, 'end_idx': 16, 'type': 'POH'}","{'word': '1965년', 'start_idx': 0, 'end_idx': 4, 'type': 'DAT'}",product:origin
2156,"프라이멀 스크림(Primal Scream)의 멤버 바비 길레스피(Bobby Gillespie)는 ""척 베리(Chuck Berry)가 ""Hail, hail, rock and roll, deliver me from the days of old""라는 곡을 들고 나왔는데, 정말 제목 그대로 이루어지고 있었다. 척 베리는 로큰롤을 통해 범세계적인 영혼 해방의 물꼬를 텄다.""라고 회고하였다.","{'word': '로큰롤', 'start_idx': 176, 'end_idx': 178, 'type': 'GEN'}","{'word': '프라이멀 스크림', 'start_idx': 0, 'end_idx': 7, 'type': 'ART'}",no_relation
1554,디지털 언더그라운드는 듣는 사람에게 펑크의 역사와 그 예술가들에 대한 지식을 교육함으로써 1990년대 펑크의 재탄생에 큰 기여를 했다.,"{'word': '펑크', 'start_idx': 57, 'end_idx': 58, 'type': 'GEN'}","{'word': '1990년대', 'start_idx': 50, 'end_idx': 55, 'type': 'DAT'}",genre:origin
694,"특히 트로트계 여성 가수들이 대거 등장하였는데 김수희, 심수봉, 주현미가 대표적이다.","{'word': '트로트', 'start_idx': 3, 'end_idx': 5, 'type': 'GEN'}","{'word': '주현미', 'start_idx': 36, 'end_idx': 38, 'type': 'ART'}",genre:artist
2429,곧 미국이 발전을 하게 되고 도시화가 진행됨에 따라 블루스에도 전기 악기가 접목되어 일렉트릭 블루스가 되었는데 특히 시카고에서 인기를 끌어 시카고 블루스라고 부르게 되었다.,"{'word': '시카고 블루스', 'start_idx': 78, 'end_idx': 84, 'type': 'GEN'}","{'word': '미국', 'start_idx': 2, 'end_idx': 3, 'type': 'LOC'}",genre:origin
2075,"빌보드지는 1970년대 처음으로 팝 록에 대해 다루기 시작하였고 이 장르의 대표적인 뮤지션으로 잭슨 파이브, 엘튼 존, 빌리 조엘, 비지스, 플리트우드 맥 등이 있다고 소개하였다.","{'word': '팝 록', 'start_idx': 18, 'end_idx': 20, 'type': 'GEN'}","{'word': '잭슨 파이브', 'start_idx': 53, 'end_idx': 58, 'type': 'ART'}",genre:artist
2830,"1970년대에 베티 카터, 아트 블레이키, 재즈 메신저 등의 그룹은 퓨전이나 재즈 록의 한복판에서 보수적인 재즈 접근방식을 유지했고, 그들의 행동을 예측하는 데 어려움을 겪으면서, 하드밥이나 비밥과 같은 전통 스타일을 진정성 있게 연주할 젊은 세대들을 찾으려고 애썼다.","{'word': '재즈 록', 'start_idx': 43, 'end_idx': 46, 'type': 'GEN'}","{'word': '하드밥', 'start_idx': 101, 'end_idx': 103, 'type': 'GEN'}",no_relation
2696,이후 몇 달 동안 이 4중주단과 함께 녹음한 콜트레인은 1965년 9월 파로아 샌더스를 초청해 밴드에 합류시켰다.,"{'word': '1965년 9월', 'start_idx': 31, 'end_idx': 38, 'type': 'DAT'}","{'word': '파로아 샌더스', 'start_idx': 40, 'end_idx': 46, 'type': 'ART'}",no_relation
1986,또 캔자스주와 오클라호마주에 걸치는 오자크 대지를 서던 마운틴에 넣는 사람도 있다.,"{'word': '서던 마운틴', 'start_idx': 29, 'end_idx': 34, 'type': 'LOC'}","{'word': '오클라호마주', 'start_idx': 9, 'end_idx': 14, 'type': 'LOC'}",no_relation
2968,"비밥 뮤지션들은 이전에 재즈에서 전형적이지 않았던 여러 개의 장치를 사용했는데, 이는 보다 추상화된 형태의 화음 기반 즉흥 연주에 관여했다.","{'word': '재즈', 'start_idx': 13, 'end_idx': 14, 'type': 'GEN'}","{'word': '비밥', 'start_idx': 0, 'end_idx': 1, 'type': 'GEN'}",genre:sub_genre
2177,한편 블랙 사바스는 주다스 프리스트와 레인보우의 헤비 메탈 노선을 따라 Technical Ecstasy를 내면서 그들 초기 음악의 어두움을 지워버렸다.,"{'word': '블랙 사바스', 'start_idx': 3, 'end_idx': 8, 'type': 'ART'}","{'word': '헤비 메탈', 'start_idx': 27, 'end_idx': 31, 'type': 'GEN'}",no_relation
3078,"1950년대 중반에는 특히 색소폰과 피아노 연주에서 리듬과 블루스, 가스펠, 블루스의 영향을 도입한 하드밥이 등장하였다.","{'word': '1950년대 중반', 'start_idx': 0, 'end_idx': 8, 'type': 'DAT'}","{'word': '가스펠', 'start_idx': 38, 'end_idx': 40, 'type': 'GEN'}",no_relation
828,마이클 마틴 머피는 90년대 카우보이 음악의 전통을 보존하려는 노력의 중심이 되었고 세부 장르로는 로데오가 있다.,"{'word': '마이클 마틴 머피', 'start_idx': 0, 'end_idx': 8, 'type': 'ART'}","{'word': '90년대', 'start_idx': 11, 'end_idx': 14, 'type': 'DAT'}",no_relation
2386,"록이라는 용어는 정의하기 모호하다. 이 단어는 때때로 여러 장르들이 모호하게 섞여있는 것, 이를테면 소울, 헤비메탈 심지어는 힙합을 포함하는 것까지, 나타내는 말로 쓰인다. ","{'word': '힙합', 'start_idx': 70, 'end_idx': 71, 'type': 'GEN'}","{'word': '헤비메탈', 'start_idx': 60, 'end_idx': 63, 'type': 'GEN'}",no_relation
2658,"빅터와 계약을 맺고 1920년대의 최고 밴드 리더가 되어 핫재즈를 했으며 빅스 비데베케, 지미 도시, 토미 도시, 프랭키 트럼바워, 조 베누티 등의 백인 뮤지션들을 고용하였다.","{'word': '1920년대', 'start_idx': 11, 'end_idx': 16, 'type': 'DAT'}","{'word': '핫재즈', 'start_idx': 32, 'end_idx': 34, 'type': 'GEN'}",no_relation
2812,"1986년, 소니 샤르록, 피터 브뢰츠만, 빌 라스웰, 로널드 섀넌 잭슨은 래스트 엑스포트라는 이름으로 첫 앨범을 녹음했는데, 이는 thrash와 프리 재즈의 유사하게 공격적인 혼합이다.","{'word': '빌 라스웰', 'start_idx': 24, 'end_idx': 28, 'type': 'ART'}","{'word': '래스트 엑스포트', 'start_idx': 42, 'end_idx': 49, 'type': 'POH'}",producer:product
968,전통 컨트리처럼 컨트리 가스펠의 사운드는 좀 더 부드러워졌고 ‘팝’스럽게 변했고 70년대 초반까지 그것은 거의 주류 팝 시장의 멋진 사운드와 구별할 수 없는 지경에 이르렀다.,"{'word': '70년대 초반', 'start_idx': 45, 'end_idx': 51, 'type': 'DAT'}","{'word': '팝', 'start_idx': 65, 'end_idx': 65, 'type': 'GEN'}",no_relation
1113,그 시대의 흑인들이 북쪽으로 이주하여 공장 노동자 생활을 하게 됨에 따라 그들이 즐기던 음악이 세련된 도시 음악인 재즈(Jazz)라는 음악과 융합을 이루게 되어 레이스 뮤직(Race Music)이라 불리는 새로운 음악을 만들어 내었다고 전해진다.,"{'word': '레이스 뮤직', 'start_idx': 90, 'end_idx': 95, 'type': 'GEN'}","{'word': '흑인', 'start_idx': 6, 'end_idx': 7, 'type': 'POH'}",genre:origin
348,"또한, 오늘날 블루스의 기본적인 형태인 12마디 블루스 역시 이 시기에 나타난 것으로 보이지만, 당시에 주로 쓰이던 형태는 12마디 블루스가 아닌, 8마디 블루스가 2번 나열되는 형태였다.","{'word': '블루스', 'start_idx': 8, 'end_idx': 10, 'type': 'GEN'}","{'word': '8마디 블루스', 'start_idx': 83, 'end_idx': 89, 'type': 'GEN'}",genre:sub_genre
3122,"1940년대 비밥 시대에, 큰 밴드들은 편곡에 여유를 내주었는데, 이 편곡은 처음에 멜로디가 짧게 명기되고 대부분의 곡이 즉흥적으로 연주되었다.","{'word': '1940년대', 'start_idx': 0, 'end_idx': 5, 'type': 'DAT'}","{'word': '비밥', 'start_idx': 7, 'end_idx': 8, 'type': 'GEN'}",no_relation
3215,하드밥은 1953년과 1954년에 결합하여 1950년대 중반에 집중적으로 개발되었다.,"{'word': '하드밥', 'start_idx': 0, 'end_idx': 2, 'type': 'GEN'}","{'word': '1953년', 'start_idx': 5, 'end_idx': 9, 'type': 'DAT'}",genre:origin
3342,"아미리 바라카는 화이트 재즈 장르가 있다고 주장한다. 1910년대 뉴올리언스에서 릴라이언스 밴드를 운영했던 파파 잭 레인은 ""화이트 재즈의 아버지""라고 불렸다.","{'word': '1910년대', 'start_idx': 30, 'end_idx': 35, 'type': 'DAT'}","{'word': '릴라이언스 밴드', 'start_idx': 45, 'end_idx': 52, 'type': 'ART'}",no_relation
2817,"1986년, 소니 샤르록, 피터 브뢰츠만, 빌 라스웰, 로널드 섀넌 잭슨은 래스트 엑스포트라는 이름으로 첫 앨범을 녹음했는데, 이는 thrash와 프리 재즈의 유사하게 공격적인 혼합이다.","{'word': '프리 재즈', 'start_idx': 82, 'end_idx': 86, 'type': 'GEN'}","{'word': '래스트 엑스포트', 'start_idx': 42, 'end_idx': 49, 'type': 'POH'}",no_relation
2270,"블랙 사바스의 음악은 하드 록 중에서도 이례적인 것이었다. 이들의 음악은 그 당시의 하드 록을 초기 헤비 메탈로 변화시켜 어두운 가사와 강한 리프, 무거운 분위기를 지니고 있었다.","{'word': '블랙 사바스', 'start_idx': 0, 'end_idx': 5, 'type': 'ART'}","{'word': '헤비 메탈', 'start_idx': 56, 'end_idx': 60, 'type': 'GEN'}",no_relation
2588,"1960년대 후반과 1970년대 초에는 재즈의 즉흥 연주와 록 리듬, 전자 악기를 결합하여 재즈 록 퓨전이라는 하이브리드 형태가 개발되었고, 지미 헨드릭스, 프랭크 자파 등 록 뮤지션들의 무대 사운드를 결합하였다.","{'word': '록', 'start_idx': 97, 'end_idx': 97, 'type': 'GEN'}","{'word': '지미 헨드릭스', 'start_idx': 79, 'end_idx': 85, 'type': 'ART'}",genre:artist
